Ravenwood,Moppy Manor,Moppy Manor,Residential,,,The Frumps,Crow's Crossing,,30x20,Not Started,,,,,,,The Frumps,,"The Frumps are a family who share the Addams family's love of the dark, the strange, and the deeply unconventional. They gather warmly, celebrate loudly, and participate in the community with an enthusiasm that most of the community finds either charming or unsettling depending on the occasion.",3,,,,,LOT00251,
Ravenwood,Old Ravenwood Estate,Old Ravenwood Estate,Custom Venue,Haunted Place/Palace,Just abandoned and haunted,,Crow's Crossing,,50x50,Not Started,,,,,,,Community,,,4,,,,,LOT00252,
Ravenwood,Eternal Hollow,Eternal Hollow,Cemetary,,,,Crow's Crossing,,64x64,Not Started,,,,,,,Community,,,5,,,,,LOT00253,
Ravenwood,Teardrop Cottage,Teardrop Cottage,Residential Small Business,Sellf Strange Plants,,Ophelia Frump,Whispering Glen,,30x30,Not Started,,,,,,,Ophelia Frump,,"Ophelia sells strange plants from Teardrop Cottage and has a gentle, floral disposition that sits slightly sideways against the broader Frump aesthetic. Something is developing between her and a spellcaster who has been finding reasons to visit Ravenwood with increasing regularity, is there romance in the air? or is one of this flowers poisonous?",6,,,,,LOT00254,
Ravenwood,The Marigold Chateau,The Marigold Chateau,Museum,,,,Whispering Glen,,50x50,Not Started,,,,,,,Community,,,7,,,,,LOT00255,
Ravenwood,Hay Hill Landing,Hay Hill Landing,Haunted House Residential,,addams,Household of IttAddams,Whispering Glen,,64x64,Not Started,,,,,,,Household of That Addams,,"It and Margaret are the ... living members of this Addams branch. Margaret, who came into the Addams family through an unexpected love story and embraced every peculiar custom with an open heart, and Itt, their son, born under circumstances the obstetrician also did not anticipate. Amenia and That Addams watch over them.",8,,,,,LOT00256,
Ravenwood,The Final Draught,The Final Draught,Bar,,Ban walkers,,Whispering Glen,,30x30,Not Started,,,,,,,Community,,,9,CClot nisak trait ban walkers,,,,LOT00257,
Ravenwood,The Cozy Casket House,The Cozy Casket House,Library,,,,Mourningvale,,30x20,Not Started,,,,,,,Community,,,10,,,,,LOT00258,
Ravenwood,Mourning Mist Manor,Mourning Mist Manor,Residential,,,Morriva Blackvein,Mourningvale,,20x20,Not Started,,,,,,,Morriva Blackvein,,"Morriva wants all the magic and all the power, and she is mean enough to take it seriously. She has surrounded herself with the most dangerous names in the occult world and is working toward something that nobody outside Mourning Mist Manor is fully aware of yet.",11,,,,,LOT00259,
Ravenwood,Club Eternity,Club Eternity,Cemetary,,,,Mourningvale,,30x20,Not Started,,,,,,,Community,,,12,,,,,LOT00260,
Ravenwood,Mystic Crossroads,Mystic Crossroads,Haunted House Residential,,addams,The Main Addams,Mourningvale,,30x30,Not Started,,,,,,,The Main Addams,,"Gomez and Morticia are the warm, terrifying centre of Ravenwood. There are ancestors who still show up for dinner, a zombie butler, witch aunts, and enough history in these walls to fill several lifetimes. Everyone can see the dead, which here is less a gift and more a guest list.",13,,,,,LOT00261,
San Myshuno,Culpepper House,Culpepper House,Apartment,17 Culpepper House,low end neighborhood,Thalia Hare,Spice market,,10x12,Not Started,10x12,108,,,,,City,,"Thalia has never quite fit anywhere, which makes a certain amount of sense when your biology involves laying eggs. Growing up as a descendant of the Easter Hare means a childhood of being the strange one, the unexplainable one, the one other kids look at sideways. She found her footing eventually, became a dancer, learned to inhabit her body with confidence in the specific context of her work, and remains quietly, persistently awkward everywhere else.",1,,,,,LOT00262,
San Myshuno,Culpepper House,Culpepper House,Apartment,18 Culpepper House,"the trait historical cannot be removed, it gives the lot a wall plaque.",Marigold Tuggerson,Spice market,,10x16,Not Started,10x16,124,,,,,City,,"Marigold's true passion has always been cleaning. Not tidying, not organising, cleaning, the kind of deep obsessive satisfaction that comes from making something immaculate. She started as a hotel housekeeper, then private residences, then somehow ended up in Kason's orbit when a client passed her name along. The job title is maid. The specifics of Blackwoods' all-round care provision are not something she advertises to her neighbours.",1.1,,,,,LOT00263,LOT00262
San Myshuno,Culpepper House,Culpepper House,Apartment,19 Culpepper House,trait needs TLC cannot be removed,The Delacroixs,Spice market,,18x10,Not Started,18x10,169,,,,,City,,"Arielle left. She packed what she wanted, found a new man in Tartosa, and left Vallis with their teenage daughter Brielle and a resentment that has only grown heavier since. Vallis was already difficult before she left. Now he drinks, brings whoever he wants home, and carries the abandonment like a wound he has decided to share with everyone within reach. Brielle has watched her mother become a stranger and her father become something worse, and she has grown to resent both of them with equal energy. She is saving money, making her own plans, and leaving the moment she can.",1.2,,,,,LOT00264,LOT00262
San Myshuno,Culpepper House,Culpepper House,Apartment,20 Culpepper House,,Kai Tanaka and Dante Vixen,Spice market,,18x16,Not Started,18x16,228,,,,,City,,"Kai got the apartment the way most things happen to Kai: someone wanted to do something nice for him and could not fully explain why afterward. A director he had briefly met mentioned a unit opening up to a producer who mentioned it to an assistant who passed it along and there Kai was, keys in hand, Dante moving in two weeks later because the rent split made sense. Kai has that effect on situations.",1.3,,,,,LOT00265,LOT00262
San Myshuno,Jasmine Suites Apartment,Jasmine Suites Apartment,Apartment,2A Jasmine Suites,,Jasmine  and Tiffany Montgomery ,Spice market,,18x6,Not Started,18x6,106,,,,,City,,,2,,,,,LOT00266,
San Myshuno,Jasmine Suites Apartment,Jasmine Suites Apartment,Apartment,2B Jasmine Suites,,"Ewald Vosler, Shalom Finkelman",Spice market,,18x7,Not Started,18x7,119,,,,,City,,"Shalom needed a flatmate and Ewald needed an address in the Spice Market, and somewhere between that and a mutual acquaintance who knew someone subletting, they ended up here. Two models, one apartment, and the kind of platonic arrangement that other people find oddly suspicious and they find entirely unremarkable.",2.1,,,,,LOT00267,LOT00266
San Myshuno,Old Salt House,Vanderburg Senate,The Capitol,,,,Spice market,,30x30,Not Started,,,,,,,Community,,,3,,,,,LOT00268,
San Myshuno,Waterside Warble,Waterside Warble,Karaoke Bar,,,,Spice market,,30x30,Not Started,30x30,,,,,,Community,,,4,,,,,LOT00269,
San Myshuno,Medina Studios Apartments,Medina Studios Apartments,Apartment,910 Medina Studios Apartments,trait needs TLC cannot be removed,Kitty Mcstuffin and Min-jun Hardae,Arts Quarter,,9x9,Not Started,9x9,81,,,,,City,,"Kason found Kitty and Min-Jun at a low point, offered them work and a place to land, and now they have an apartment in the Arts Quarter and employment that keeps the lights on. Nobody signed anything that said they owed him. Nobody had to. They both know what being on the street looks like and they both know who pulled them off it, and that is a debt that does not need to be written down to be very, very real.",5,,,,,LOT00270,
San Myshuno,Medina Studios Apartments,Medina Studios Apartments,Apartment,920 Medina Studios Apartments,trait quiet cannot be trmoved,Axara Nodeweft,Arts Quarter,,12x16,Not Started,12x16,145,,,,,City,,"Axara grew up somewhere considerably smaller and quieter than San Myshuno, which is exactly why she left. The city was where the work was and the work was where she needed to be, and she traded rural quiet for an Arts Quarter studio and never looked back. She is a tech guru who happens to practice the craft, modernised enough that most people she works with would never guess the latter.",5.1,,,,,LOT00271,LOT00270
San Myshuno,Medina Studios Apartments,Medina Studios Apartments,Apartment,930 Medina Studios Apartments,,Marisol Ferreira  and Liam Montenegro,Arts Quarter,,13x28,Not Started,13x28,291,,,,,City,,"Liam's sister Emma is an A.W.E. actress. Liam is a stripper, which is not what their parents planned but is also not entirely their fault given how little those parents invested in either of them. Somewhere out there Liam has an older brother his parents abandoned before he was even born, a fact Emma has spent years telling him to let go of. He has not let go of it. Marisol, who has her own complicated relationship with moving on, has been helping him look. They are not a couple. They are two people with too much history and not enough answers, sharing a studio in the Arts Quarter and making it work.",5.2,,,,,LOT00272,LOT00270
San Myshuno,Hakim House Apartments,Hakim House Apartments,Apartment,121 Hakim House,,Dafne Hansmann,Arts Quarter,,11x18,Not Started,11x18,172,,,,,City,,Dafne is an A.W.E. producer who has learned that the fastest way to get what you need in this industry is to make yourself useful in ways that go beyond the job description. She is good at her work and equally good at knowing when a favour is being offered and what to offer in return.,6,,,,,LOT00273,
San Myshuno,Hakim House Apartments,Hakim House Apartments,Apartment,122 Hakim House,trait historical cannot be removed,Vernon Cornelio,Arts Quarter,,16x17,Not Started,16x17,242,,,,,City,,Vernon is an A.W.E. director on his way up and has made himself useful to the kinds of people who make that climb easier. The company he keeps says as much as his résumé does.,6.1,,,,,LOT00274,LOT00273
San Myshuno,Fountainview Penthouse,Fountainview Penthouse,Penthouse,,,Orin Cadencemire,Arts Quarter,,30x20,Not Started,30x20,,,,,,pent,,"Orin is on his way up and he has arranged his life accordingly. The penthouse came before the fame, which is either delusional or visionary, and the answer to that question is being settled in real time. He is ambitious, he is talented, and San Myshuno is exactly the right city for someone who has decided, with complete sincerity, that obscurity is temporary.",7,,,,,LOT00275,
San Myshuno,Casbah Gallery,Casbah Gallery,Arts center,,,,Arts Quarter,,40x30,Not Started,40x30,,,,,,Community,,,8,,,,,LOT00276,
San Myshuno,Zenview Apartments,Zenview Apartments,Apartment,701 Zenview,Similar to shanghai/ tokyo,Empty (for Jade Ridley),Fashion District,,6x11,Not Started,6x11,66,14x12,138,,,City,,,9,,,,,LOT00277,
San Myshuno,Zenview Apartments,Zenview Apartments,Apartment,702 Zenview,,Bayani Macaraeg and Kemal Y1ldiz,Fashion District,,14x12,Not Started,14x12,122,13x8,78,,,City,,"They are both fashion designers living in the only neighbourhood that truly understands what that means, and they both arrived with something to shake up. Bayani has the experience and the eye and the quiet authority of someone who has been in the room long enough to know which battles matter. Kemal has the intensity and the ambition and the specific energy of someone who has not been in the room long enough to be careful yet. Between them, the Fashion District is about to hear from both.",9.1,,,,,LOT00278,LOT00277
San Myshuno,21 Chic Street Apartments,21 Chic Street Apartments,Apartment,1310 21 Chic Street ,trait liveley neighbors cannot be removed,Rubinoffs,Fashion District,,6x12,Not Started,6x12,72,,,,,City,,"Rhodes is a sharper lawyer because of Haya, and he knows it. She is still finishing her psychology degree and already she reads people in ways that have changed how he argues a case, how he reads a room, how he handles the moments where the law and the person in front of him are pulling in opposite directions. They are a good team.",10,,,,,LOT00279,
San Myshuno,21 Chic Street Apartments,21 Chic Street Apartments,Apartment,1312 21 Chic Street ,trait lively neighbors cannot be removed,Shalom Finkelman and Landon Engelbert,Fashion District,,9x10,Not Started,9x10,80,,,,,City,,"A model and a politician sharing a flat in 21 Chic Street, which is an unusual combination by any measure. They are perfectly platonic, apparently by mutual agreement, which their respective social circles find baffling and neither of them has ever bothered to explain.",10.1,,,,,LOT00280,LOT00279
San Myshuno,21 Chic Street Apartments,21 Chic Street Apartments,Apartment,1313 21 Chic Street ,trait needs TLC cannot be removedhas tape outline of body in living room which cannot be removed,Okafors,Fashion District,,16x7,Not Started,16x7,81,,,,,City,,"Tayo is adopted, which she has always known, and Willow Creek is where she came from, which she has tried to leave behind. She moved to San Myshuno for herself and her children, away from a neighbourhood that had started losing people in ways nobody could explain. Four very small children and a civil design career and a city apartment that is nothing like where she grew up. That is the point.",10.2,,,,,LOT00281,LOT00279
San Myshuno,Torendi Tower Penthouse,Torendi Tower Penthouse,Penthouse,,,Cassian Falkenrath,Fashion District,,40x30,Not Started,40x30,,,,,,pent,,"Cassian is an elder lawyer at the top of his field, the kind of corporate operator who has been bleeding clients dry for decades with the calm efficiency of someone who has always known exactly what he wants. People who work with him occasionally remark that he does not seem to age. Must be all those lies keeping him young.",11,,,,,LOT00282,
San Myshuno,Planet Honey Pop!,Planet Honey Pop!,Luxe Legacy,,only for career and shopping,,Fashion District,,30x20,Not Started,,,,,,,Community,,,12,"RSVN take a dance on me, Danity simmer fashion desiner mod, luxe leacy folder, Littlemssam WEE, Cherisi dynamic frames, dressing room mod",,,,LOT00283,
San Myshuno,Alto Apartments,Alto Apartments,Apartment,1010 Alto Apartments,fancy apartments,Wesleys,Uptown,,37x18,Not Started,37x18,478,,,,,City,,"There is a version of the Wesley household that looks fine from the outside: uptown address, two incomes, four people under one roof. The version on the inside is something else. Zane keeps the lights on and asks very few questions. Theresa drinks to soften the edges of a life she did not quite end up wanting, and her attention drifts toward anyone who offers her something she feels she is missing. Francesca has watched all of it long enough to know exactly what she wants, which is out, a law degree, a life that looks nothing like this one. Bogdan is still deciding what to do with how angry he is.",13,,,,,LOT00284,
San Myshuno,Alto Apartments,Alto Apartments,Apartment,1020 Alto Apartments,trait fireplace and romantic atmosphere cannot be removed,Ramos Keith,Uptown,,36x18,Not Started,36x18,397,,,,,City,,"Ramos is a photographer but not the kind that ends up in magazines. He is interested in what the human eye is not supposed to see, the moments that happen just outside the frame of the official story. His connections run to people who find that useful. He lives alone uptown and keeps the work quiet.",13.1,,,,,LOT00285,LOT00284
San Myshuno,Landgraab Apartments,Landgraab Apartments,Apartment,VII Landgraab,traits great view and serviced apartmen cannot be removed,Propsero and Juno Usher,Uptown,,16x14,Not Started,16x14,193,19x18,275,,,City,,"Prospero is a young Usher who coasts on his family's name with the ease of someone who has never had to do anything the hard way. Juno is his model wife, beautiful and perfectly cast in the role of Usher spouse.",14,,,,,LOT00286,
San Myshuno,Landgraab Apartments,Landgraab Apartments,Apartment,IX Landgraab,"Feng family, trait great view cannot be removed",Lucian Sinclair,Uptown,,15x18,Not Started,15x18,222,14x18,202,,,City,,"Lucian Sinclair is a legend in the industry, which would be remarkable enough on its own. What people cannot stop talking about is how he has looked exactly the same for as long as anyone can remember. The roles keep coming, the face never changes, and nobody in the business has ever gotten a straight answer about his skincare routine.",14.1,,,,,LOT00287,LOT00286
San Myshuno,Spire Apartments,Spire Apartments,Apartment,888 Spire Apartments,trait great view cannot be removed,Khlas Weiner,Uptown,,18x3,Not Started,18x3,213,18x3,197,18x3,218,City,,"Khlas is a famous A.W.E. actor, raunchy, rakish, and a spectacular spender who lives lavish and treats the city like a personal playground. He is extremely fun at parties and a nightmare in every other context.",15,,,,,LOT00288,
San Myshuno,Stargazer Lounge,Starlight Casino,Casino,,turn into casino,,Uptown,,40x30,Not Started,40x30,,,,,,Community,,,16,,,,,LOT00289,
San Myshuno,Skye Fitness,The Gilded Lily,Strip Club,Strip Club,"Redo speakers
ADD BOUNCER",,Uptown,"§285,035",30x20,Not Started,,,,,,,Kason Blackwood,,,17,"RSVN vfx , no dancing , nisak , Gilded lily and blazing plumage lot trait
cclottrait littlemssam , basemantal drugs",,,,LOT00290,
San Myshuno,Myshuno Meadows,Myshuno Meadows,Park,,,,Uptown,,64x64,Not Started,64x64,,,,,,Community,,,18,,,,,LOT00291,
San Sequoia,Robles Point,Robles Point,Residential,,,The 0anef1js,Anchorpoint Wharf,,50x40,Not Started,,,,,,,The Duval-Medleys,,"R0vanx is an elder doctor and Senior Pollination Technician raising her toddler S0lar1s in San Sequoia, wife to Axel, who is elsewhere. ",1,,,,,LOT00292,
San Sequoia,Manzanita Terrace,Manzanita Terrace,Playground,,,,Anchorpoint Wharf,,30x20,Not Started,,,,,,,Community,,,2,,,,,LOT00293,
San Sequoia,Anchorpoint Library,Anchorpoint Library,Library,,,,Anchorpoint Wharf,,30x20,Not Started,,,,,,,Community,,,3,,,,,LOT00294,
San Sequoia,Anchorpoint Abode,Anchorpoint Abode,Pool,,,,Anchorpoint Wharf,,30x20,Not Started,,,,,,,Community,,,4,,,,,LOT00295,
San Sequoia,13 Acacia Avenue,13 Acacia Avenue,Residential,,,The #Ng%s,Gilbert Gardens,,40x30,Not Started,,,,,,,The #Ng%s,,Zantar is a detective raising an infant son named Myvex alone in San Sequoia. ,5,,,,,LOT00296,
San Sequoia,Parkside Place,Parkside Place,Custom Venue,Pregnancy Care,,,Gilbert Gardens,,30x20,Not Started,,,,,,,Community,,,6,,,,,LOT00297,
San Sequoia,18 Celebration Way,18 Celebration Way,Cafe,,,,Gilbert Gardens,,40x20,Not Started,,,,,,,Community,,,7,,,,,LOT00298,
San Sequoia,Celebration Center,Celebration Center,Recreation Center,,,,Gilbert Gardens,,64x64,Not Started,,,,,,,Community,,,8,,,,,LOT00299,
San Sequoia,7 Eucalyptus Lane,7 Eucalyptus Lane,Custom Venue,Nursing Home,,,Hopewell Hills,,50x40,Not Started,,,,,,,Community,,,9,,,,,LOT00300,
San Sequoia,23 Eucalyptus Lane,23 Eucalyptus Lane,Residential,,,The Jacobs,Hopewell Hills,,30x20,Not Started,,,,,,,The Jacobs,,"David Jacobs was abandoned by his parents as a teenager and swallowed the damage whole, letting it calcify into control and repression and the particular cruelty of a man who married a woman he could never truly love. Elaine drinks. Nate is his father's son in many ways, popular, desired and managing a secret he has buried so deep he barely knows it's there. This is a house where no one says what they mean and everyone pays for it.",10,,,,,LOT00301,
San Sequoia,36 Bayani Place,36 Bayani Place,Residential,,evict luna-sullivan,Chaudhary,Hopewell Hills,,30x20,Not Started,,,,,,,Chaudhary,,"Sajan Chaudhary is a gifted mixologist who has spent years making herself smaller in her own home because Karanveer cannot tolerate the size of her talent. Four children are growing up watching this, and Madhav has decided if he can make everyone laugh hard enough, the weight of the house might lift for a moment. It never quite does, but he keeps trying.",11,,,,,LOT00302,
San Sequoia,Sequoia Cottage,Sequoia Cottage,Tiny Home Residential,,,The Mehras,Hopewell Hills,,30x20,Not Started,,,,,,,The Mehras,,"Snehit and Snehal raised three children: Priya, a devoted trad wife in San Sequoia; Shalini, a globe-trotting fashion icon who has still not married, which her parents have not stopped mentioning; and Rajiv, whose wife Priya they consider a triumph. They moved to Sequoia Cottage to retire, which in practice means they are now available full-time to have opinions about everything.",12,,,,,LOT00303,
Selvadorada,Alam Museum Of Archeology,Alam Museum Of Archeology,Museum,,,,Puerto Llamante Marketplace,,64x64,Not Started,,,,,,,Community,,,1,,,,,LOT00304,
Selvadorada,Hillview Hideaway,Hillview Hideaway,Vacation Rental,,,,Puerto Llamante Marketplace,,20x15,Not Started,,,,,,,Community,,,2,,,,,LOT00305,
Selvadorada,Selvadorada Villa,Selvadorada Villa,Vacation Rental,,,,Puerto Llamante Marketplace,,30x20,Not Started,,,,,,,Community,,,3,,,,,LOT00306,
Selvadorada,"Catina ""El Arbol Del Jaguar""","Catina ""El Arbol Del Jaguar""",Bar,,DO NOT REPLACE LOT TYPE,,Puerto Llamante Marketplace,,40x30,Not Started,,,,,,,Community,,,4,,,,,LOT00307,
Selvadorada,Belomisia Trailhead,Belomisia Trailhead,National Park,,,,Belomisia Jungle,,40x20,Not Started,,,,,,,Community,,,5,,,,,LOT00308,
Selvadorada,Jungle Bungalow,Jungle Bungalow,Vacation Rental,,,,Belomisia Jungle,,30x30,Not Started,,,,,,,Community,,,6,,,,,LOT00309,
Selvadorada,Belomisia Field Station,Belomisia Field Station,Vacation Rental,,,,Belomisia Jungle,,30x20,Not Started,,,,,,,Community,,,7,,,,,LOT00310,
Strangerville,8 Bells,8 Bells,Bar,Bar,DO NOT REPLACE LOT TYPE,,Strangerville Plaza,,20x20,Not Started,,,,,,,Community,,,1,,,,,LOT00311,
Strangerville,Strangerville Informaition center,Strangerville Informaition center,Library,Library,DO NOT REPLACE LOT TYPE,,Strangerville Plaza,,20x20,Not Started,,,,,,,Community,,,2,,,,,LOT00312,
Strangerville,Carpophagaus Corner,The Normalcy Center,Church,,"Church for Congregation of non Belivers
[We gather here to not believe,
No comfort sought, none to receive.
The universe runs on logic alone 
We test each claim before it's known.
No faith required, no altar lit;
We simply think, and that is it.]",Allie Genn,Strangerville Plaza,,30x20,Not Started,,,,,,,Allie Genn,,"Allie has been tasked with a very specific mission: maintain normalcy. She works alongside the Mother Plant to keep Strangerville's citizens in a state of cooperative calm, and she does it with the kind of quiet authority that makes the whole operation look like a wellness initiative.",3,,,,,LOT00313,
Strangerville,Slip 42,Mother's Inn,Hotel,seedy motel,Alien Themes,,Strangerville Plaza,,20x15,Not Started,,,,,,,Prospero and Juno Usher,,,4,,,,,LOT00314,
Strangerville,Old Penelope,Old Penelope,Residential,,add matrix animated walpaper,Mad scientist,Strangerville Plaza,,50x40,Not Started,,,,,,,Mad scientist,,"Tesla is a mad scientist with a deep distrust of the government and a deeper fascination with the things it would prefer he left alone. He lives off the grid, performs experiments nobody has approved, and considers bureaucratic oversight a personal insult. Ergot is his plantsim companion, strange and devoted, helping with the experiments purely because it wants to. Their arrangement defies easy description and neither of them is interested in providing one.",5,,,,,LOT00315,
Strangerville,Riverside Grove,Riverside Grove,Residential,,,The Sigworths,Strangerville Plaza,,30x20,Not Started,,,,,,,The Sigworths,,The Sigworths are new in town. Jess transferred to the StrangerVille National Base and Dylan came with her. It took a few days before Dylan started noticing something different about his wife.,6,,,,,LOT00316,
Strangerville,Cliff Side Crest,Cliff Side Crest,Residential,,,The Lystads,Shady Acres,,30x20,Not Started,,,,,,,The Lystads,,"Lars and Sigrid are both military, both stationed in Strangerville, and both carrying something home with them that was not there before.",7,,,,,LOT00317,
Strangerville,Creek Corner Cove,Creek Corner Cove,Residential,,,Warden Marcus and his kid,Shady Acres,,30x20,Not Started,,,,,,,Warden Marcus and his kid,,"Marcus follows orders and enforces the law and does not ask questions about either, which is exactly what makes him useful here.",8,,,,,LOT00318,
Strangerville,Plateau Place,Fort Bootlicker Academy,Custom Venue,Military School,,,Shady Acres,,40x30,Not Started,,,,,,,Community,,,9,,,,,LOT00319,
Strangerville,Dream Weavers Way,Dream Weavers Way,Custom Venue,Military Training Facility,,,Shady Acres,,30x20,Not Started,,,,,,,Community,,,10,,,,,LOT00320,
Strangerville,Strangerville Overlook,Strangerville Overlook,Residential,,,The Roswells,Shady Acres,,40x30,Not Started,,,,,,,The Roswells,,"Ted Roswell is the mayor and has been aggressively pushing StrangerVille toward technological advancement with a focus on the Crater Base and Secret Lab, which has required some deals he would prefer not to disclose.",11,,,,,LOT00321,
Strangerville,The ?????? Lab,The ?????? Lab,The ?????? Lab,The ?????? Lab,DO NOT REPLACE LOT TYPE,,The ?????? Lab,,64x64,Not Started,,,,,,,Community,,,12,,,,,LOT00322,
Sulani,Admiral's Wreckage,Admiral's Wreckage,Custom Venue,Mermaid cove,,,Mua Pel'am,,50x50,Not Started,,,,,,,Community,,,1,,,,,LOT00323,
Sulani,Caldera camp,Caldera camp,Residential,,Ssea witch lair,Hinaopele Anuhewa,Mua Pel'am,,30x20,Not Started,,,,,,,Hinaopele Anuhewa,,"Hinaopele wants every power the sea has ever offered and then some. The voice of a siren, the craft of a witch, the patience of something ancient and cold and waiting beneath the tide. She lures sims toward the depths with a song they cannot stop following and a smile that has never once been about them. Mua Pel'am is her kingdom and everyone in it is either useful or unaware.",2,,,,,LOT00324,
Sulani,Key Point,Key Point,Residential,,,The Keawes,Mua Pel'am,,40x30,Not Started,,,,,,,The Keawes,,"The Keawes are a family that the whole of Mua Pel'am knows. Iolana and Leimana are embedded in the community by profession and by disposition, raising Maris and Keola in the kind of household where the door is always open and the neighbours know they are welcome.",3,,,,,LOT00325,
