Mt Komorebi,6-4-1 Hanamigawa,6-4-1 Hanamigawa,Karaoke Bar,,,,Senbamachi,,20x15,Not Started,,,,,,,Community,,,8,,,,,LOT00171,
Mt Komorebi,Hanamigawa Koen,Hanamigawa Koen,Park,,Ban walkers,,Senbamachi,,30x20,Not Started,,,,,,,Community,,,9,CClot nisak trait ban walkers,,,,LOT00172,
Mt Komorebi,Izakaya Ippai,Izakaya Ippai,Gym,,,,Senbamachi,,30x20,Not Started,,,,,,,Community,,,10,,,,,LOT00173,
Mt Komorebi,5-1-1 Kiyomatsu,5-1-1 Kiyomatsu,Residential,,,Inukais,Yukimatsu,,30x20,Not Started,,,,,,,Inukais,,"Oda and Jin raised their children in Kiyomatsu and have always been the well-mannered face of the nine-tailed Inukai family. Pro-human, cordial with the Moonwood Mill pack, respectable neighbours by every measure. Fox-natured through and through, which means the well-mannered face is doing a lot of work.",11,,,,,LOT00174,
Mt Komorebi,5-1-2 Kiyomatsu,5-1-2 Kiyomatsu,Vacation Rental,,,,Yukimatsu,,30x20,Not Started,,,,,,,Community,,,12,,,,,LOT00175,
Mt Komorebi,Sutefani Onsen Bathhouse,Sutefani Onsen Bathhouse,Onsen Bathhouse,,DO NOT REPLACE LOT TYPE,,Yukimatsu,,30x20,Not Started,,,,,,,Community,,,13,,,,,LOT00176,
Mt Komorebi,Kiyomatsu Point,Kiyomatsu Point,Residential,,,Cryon Glacius,Yukimatsu,,50x50,Not Started,,,,,,,Cryon Glacius,,"Only after reaching the peak of Mt Komorebi will you find Cryon Glacius. He doesn't want to be found, especially by inferior species, so you had better start heading back the way you came before he notices you were ever there.",14,,,,,LOT00177,
Newcrest,Fern Park,A.L.N Law Firm,Law firm,lawer lot,,,Brideview,"§227,085",30x20,Not Started,,,,,,,Community,,,1,"Kiarasims4 lawyer career , Wiked whims",,,,LOT00178,
Newcrest,Beech Byway,Moshino Studio,Photo Studio,Photo Studio and career lot,,,Brideview,"§204,479",30x20,Not Started,,,,,,,Community,,,2,"Cherisi Photographer, andrew pose player Wiked whims",,,,LOT00179,
Newcrest,Midtown Meadows,Midtown City Hall,City Hall,,6 free computers counting the assistant too,,Brideview,,40x30,Not Started,,,,,,,Community,,,3,,,,,LOT00180,
Newcrest,Oak Alcove,Simoleon Trust,SNBank,Bank,,,Brideview,"§151,706",20x15,Not Started,,,,,,,Community,,,4,,,,,LOT00181,
Newcrest,Comfy Cubby,Comfy Cubby,Backroom,,,,Brideview,,20x15,Not Started,,,,,,,Community,,,5,,,,,LOT00182,
Newcrest,Twin Oracle Point,Twin Plumbob Primary,Elementary School,Middleschool,,,Llama Lagoon,,50x40,Not Started,,,,,,,Community,,,6,"Zerbu go to school mod, folder for cc, lot51 free range, Wiked whims
Adeepindigo janitor's closet",,,,LOT00183,
Newcrest,Avarice Acres,Giggles And Grins Nook,Playground,,,,Llama Lagoon,,40x30,Not Started,,,,,,,Community,,,7,,,,,LOT00184,
Newcrest,Rippling Flats,Tiny Tots Daycare,Daycare,,,,Llama Lagoon,"§108,973",40x30,Not Started,,,,,,,Community,,,8,itskatato tumbling tots daycare Wicked whims,,,,LOT00185,
Newcrest,Tranquil Cresent,Tranquil Cresent,Pool,Practice pool for children,,,Llama Lagoon,,30x30,Not Started,,,,,,,Community,,,9,,,,,LOT00186,
Newcrest,Asphalt Abodes,Asphalt Abodes,Park,kids play sports here,Ban walkers,,Llama Lagoon,,30x20,Not Started,,,,,,,Community,,,10,CClot nisak trait ban walkers,,,,LOT00187,
Newcrest,Sandy Run,Sandy Run,Residential Rental,,owned By the Landgraabs,Naomi Lapaglia and Landon Engelbert,Ridgeline Drive,,40x20,Not Started,,,,,,,The Landgraabs,,"Naomi is a just and fair lawyer sharing a rental with Landon, a politician. Whether their values align outside of work is anyone's guess.",11,,,,,LOT00188,
Newcrest,Cookout Lookout,Kimura Mansion,Governor's Mansion,career lot for politcian,,,Ridgeline Drive,"§126,033",30x20,Not Started,,,,,,,Community,,,12,Kiarasims4career Wiked whims,,,,LOT00189,
Newcrest,Civic Cliffs,Civic Cliffs,Cafe,,,,Ridgeline Drive,,30x20,Not Started,,,,,,,Community,,,13,,,,,LOT00190,
Newcrest,Hillside Highlands,Justine Courthouse,Supreme Court Building,Lawer lot,,,Ridgeline Drive,"§135,719",30x20,Not Started,,,,,,,Community,,,14,Kiarasims4career Wiked whims,,,,LOT00191,
Newcrest,Optimist's Outlook,The Sim House,The Sim House,Politican career,country club,,Ridgeline Drive,"§405,913",40x30,Not Started,,,,,,,Community,,,15,Kiarasims4career Wiked whims,,,,LOT00192,
Nordhaven,Konst Modern,Konst Modern,Museum,,,,Gammelvik,,50x40,Not Started,,,,,,,Community,,,1,,,,,LOT00193,
Nordhaven,The Rouge Note,The Rouge Note,Lounge,,,,Gammelvik,,20x20,Not Started,,,,,,,Community,,,2,,,,,LOT00194,
Nordhaven,Koffieboon,Koffieboon,Backroom,,,,Gammelvik,,20x20,Not Started,,,,,,,Community,,,3,,,,,LOT00195,
Nordhaven,Old Torget House,Old Torget House,Tiny Home Residential,,,Ingrid Kaufmann,Gammelvik,,20x15,Not Started,,,,,,,Ingrid Kaufmann,,"Ingrid is an elderly sim who wants to photograph the world, and Nordhaven is simply where he ended up while doing it.",4,,,,,LOT00196,
Nordhaven,Fisher's Horizon,Fisher's Horizon,Residential,,,"Winona Grayhawk, Mwendo and Rocco Montegioia",Gammelvik,,30x20,Not Started,,,,,,,"Winona Grayhawk, Mwendo and Rocco Montegioia",,"Winona grew up in a household that gave her a father by paperwork and neglectful guardian by practice, and then found her way to Nordhaven where she built a poly life entirely on her own terms with two people she chose. Her conservation work, her partners, and the distance between her and the Faircroft farm are all intentional. None of it is up for discussion.",5,,,,,LOT00197,
Nordhaven,Comfortably Canalside,Comfortably Canalside,Cafe,,,,Gammelvik,,20x20,Not Started,,,,,,,Community,,,6,,,,,LOT00198,
Nordhaven,New Harbor Park,New Harbor Park,Residential Small Business,Candy store,owned by the elderly Bhatnagars who have retired,Bhatnagars,Iverstad,,50x40,Not Started,,,,,,,Bhatnagars,,"After raising their kids and watching them build lives of their own, Nirav and Amrita came to Nordhaven to finally rest. They have a small shop and a quiet life.",7,,,,,LOT00199,
Nordhaven,Terra-Potta,Terra-Potta,Residential Small Business,Pottery and bakery,Aslo a teaching studio,Faircrofts,Iverstad,,30x20,Not Started,,,,,,,Faircrofts,,"Claire left Lucien Faircroft to be with his half-brother Benedict, which the family did not take quietly and Bartholomew will never forgive. Benedict and Claire took their pottery and their baking and their complicated history to Nordhaven and built something calm and genuine out of it.",8,,,,,LOT00200,
Nordhaven,The Old Foundry,The Old Foundry,Residential,,,Inez Calder and Andre Jafari,Iverstad,,20x15,Not Started,,,,,,,Inez Calder and Andre Jafari,,"Inez and Andre are both dancers, but the money is not what it should be and the gap between what Inez earns and what she spends has been closing in ways that have led her somewhere she did not plan to go. The drug problem is not helping any of it.",9,,,,,LOT00201,
Nordhaven,Spilled Neon,Spilled Neon,Nightclub,,,,Iverstad,,20x20,Not Started,,,,,,,Community,,,10,,,,,LOT00202,
Nordhaven,Inked Inlet,Inked Inlet,Residential Small Business,tatto shop,,Dakota Grayhawk,Iverstad,,20x20,Not Started,,,,,,,Dakota Grayhawk,,"Dakota is a tattoo artist who fathered Winona and Chayton with a woman who was already someone else's wife. He was not in their lives the way he should have been, and he knows it, and now he is in Nordhaven trying to be present for his daughter in the way that geography and circumstance previously prevented.",11,,,,,LOT00203,
Nordhaven,Lighthouse Lookout,Lighthouse Lookout,Playground,,,,Iverstad,,50x40,Not Started,,,,,,,Community,,,12,,,,,LOT00204,
Oasis Springs,Affluista Mansion ,Affluista Mansion ,Residential,Residential ,,Landgraabs ,Acquisition Butte ,"§280,340",50x50 ,Not Started,,,,,,,The Landgraabs,,"The Landgraabs are one of the most powerful families in the save. Nancy is a real estate tycoon with more influence than most people will ever know. Geoffrey is her devoted husband. Malcolm is their son, already calculating his way toward the top of something large and not particularly concerned with what it costs. There was a third Landgraab once, a son who decided the family name was more burden than benefit and walked away from all of it. The Landgraabs do not bring him up.",1,"lot51 doorbell, Law and disorder , Wicked whims",,,,LOT00205,
Oasis Springs,Yuma Heights ,Yuma Heights ,Residential,Residential ,,Milton Moretti,Acquisition Butte ,"§216,889",40x30,Not Started,,,,,,,Milton Moretti,,"Milton worked hard to get where he is, which is the charitable reading. The less charitable one is that he stepped on a number of people, made a number of deals that would not survive daylight, and arrived at the top of the legal ladder having made himself very useful to the people who needed someone like him.",2,"lot51 doorbell, Law and disorder , Wicked whims",,,,LOT00206,
Oasis Springs,Sandtrap Flat,Sandtrap Flat,Hotel,Motel,,,Bedrock Strait,"§125,022",30x20,Not Started,,,,,,,Prospero and Juno Usher,,,3,"lot51 suite life, Wicked whims",,,,LOT00207,
Oasis Springs,Pebble Burrow,The Burrow,Custom Venue,"Junkyard, homeless hangout ",,,Bedrock Strait,"§27,091",30x20,Not Started,,,,,,,Community,,,4,rsvn hobo stuff,,,,LOT00208,
Oasis Springs,Slipshod Mesquite ,Slipshod Mesquite ,Residential Rental,Slipshod Mesquite unit one,"Owned by the LANDGRAABS ,no smoking inside,mold,heist havoc,",Raven O'Reilly,Bedrock Strait,"§181,936",40x30,Not Started,,,,,,,The Landgraabs,,"Oasis Springs will bleed you dry if you let it, and Raven is not letting it. The rent is too high and the options are limited and she has made her calculations accordingly. Dancing pays, Raven likes to dance.",5,"Rsvn Hobo stuff, Nisak , Kritical, Basemental drugs, gambling, gang, working pet water bowl, Basemental drugs, gang, gambling wicked whims
cc lot trait; Littlemssam live in bar",,,,LOT00209,
Oasis Springs,Slipshod Mesquite ,Slipshod Mesquite ,Residential Rental,Slipshod Mesquite unit two,"heist havoc,sketchy,gremlins",Gussavo Narravo,Bedrock Strait,,,Not Started,,,,,,,The Landgraabs,,"Gussavo is exactly the kind of person Oasis Springs produces: money-hungry, sharp, and entirely comfortable in morally flexible situations. The city rewards that and he has always known it. He ended up in Bedrock Strait by following the money and he has no plans to follow it anywhere smaller.",5.1,"Rsvn Hobo stuff, Nisak , Kritical, Basemental drugs, gambling, gang, working pet water bowl, Basemental drugs, gang, gambling wicked whims
cc lot trait; Littlemssam live in bar",,,,LOT00210,LOT00209
Oasis Springs,Slipshod Mesquite ,Slipshod Mesquite ,Residential Rental,Slipshod Mesquite unit three,"heist havoc,sketchy,gremlins","Deshawn Freeman, Elias Freeman, Latoya Freeman and dog cheese",Bedrock Strait,,,Not Started,,,,,,,The Landgraabs,,"Deshawn and Elias did not set out to become who they are. Oasis Springs just has a way of presenting options to people without many, and circumstance has a way of becoming something before you notice. Their older sister Shayla is not happy about any of it and neither, honestly, are they. But survival in Oasis Springs looks like what it looks like.",5.2,"Rsvn Hobo stuff, Nisak , Kritical, Basemental drugs, gambling, gang, working pet water bowl, Basemental drugs, gang, gambling wicked whims
cc lot trait; Littlemssam live in bar",,,,LOT00211,LOT00209
Oasis Springs,Slipshod Mesquite ,Slipshod Mesquite ,Residential Rental,Slipshod Mesquite unit four,"gremlins,sketchy,filthy, MIGHT REMVE TO BE NPCS",Diamond Johnston  and boyfriend Leo Romano,Bedrock Strait,,,Not Started,,,,,,,The Landgraabs,,"Leo has been trying to make this work for longer than is probably healthy. Diamond is volatile, possessive, and not above making that his problem physically when things go sideways. On again right now. Ask again next week.",5.3,"Rsvn Hobo stuff, Nisak , Kritical, Basemental drugs, gambling, gang, working pet water bowl, Basemental drugs, gang, gambling wicked whims
cc lot trait; Littlemssam live in bar",,,,LOT00212,LOT00209
Oasis Springs,Slipshod Mesquite ,Slipshod Mesquite ,Residential Rental,Slipshod Mesquite unit five,"Gremlins,sketchy,heist havoc",One Drug dealer and Cole Heist,Bedrock Strait,,,Not Started,,,,,,,The Landgraabs,,"Cole is tough, low on income, and not particularly precious about where the next job comes from. He and his flatmate share a unit in Bedrock Strait and an understanding that questions are not part of the arrangement. If the work is there he will do it. Oasis Springs has plenty of work for a man like Cole.",5.4,"Rsvn Hobo stuff, Nisak , Kritical, Basemental drugs, gambling, gang, working pet water bowl, Basemental drugs, gang, gambling wicked whims
cc lot trait; Littlemssam live in bar",,,,LOT00213,LOT00209
Oasis Springs,Agave Abode ,Agave Abode ,Residential,Residential ,,The Rollins,Bedrock Strait,"§46,378",20x15 ,Not Started,,,,,,,The Landgraabs,,Darius is a soul food visionary who owes more than he can currently pay. Shayla is an educator holding the family together and believing in the restaurant dream more than she lets on. Javante is seventeen and somewhere between the art he was always supposed to pursue and the gang life that has started to look like a faster answer.,6,"Oni food, Srsly food, SCCCO, icemunmun food, Simrealist HLC, LBB food wicked whims",,,,LOT00214,
Oasis Springs,Nookstone ,Rollin Stove,Restaurant,Soul Food,owned by The Rollins,Waitin for rollins,Bedrock Strait,"§53,837",20x15,Not Started,,,,,,,waitin for rollins,,,7,"Oni food, Srsly food, SCCCO, icemunmun food, LBB food, Carl dine out reloaded, Amcelle food, Nisak Kritical Basemental drugs, gang wicked whims",,,,LOT00215,
Oasis Springs,Desert Bloom Park,The Purple pulse,Rave,Rave,Redo speakers,,Desert Bloom Park ,"§123,899",50x50 ,Not Started,,,,,,,Community,,,8,"RSVN VFX, Revi rei laser lights, Kritical , nisak Wicked whimsCherisi deco sims build folder
CClottrait sketcy#",,,,LOT00216,
Oasis Springs,The Futures Past,The Blazing Plumage,Strip Club,Strip Club,owned by Kason  Redo speakers,,Mirage Canyon ,"§71,500",30x20,Not Started,,,,,,,Kason Blackwood,,,9,"RSVN Vfx, nisak Kritical, Wicked whims, deco blazing sims folder
CClottrait Sketchy, escort center, hypersexual",,,,LOT00217,
Oasis Springs,The Solar Flare,Sunburned Sativa,Retail,Dispensary ,owned by Isolde,,Mirage Canyon ,"§71,500",30x20,Not Started,,,,,,,Isolde Kovac,,,10,"Basemental drugs, gangs",,,,LOT00218,
Oasis Springs,Burners and Builders ,Burners and Builders ,Gym,Gym,check for front desk,,Mirage Canyon ,"§98,272",40x30 ,Not Started,,,,,,,Community,,,11,"Basemental drugs, gangs Wicked whims Nisak
cclottraot LMS auto employees, sketcy",,,,LOT00219,
Oasis Springs,Rattlesnake juice ,Rattlesnake Tower,Bar,Bar,,,Mirage Canyon ,"§272,435",30x20 ,Not Started,,,,,,,Community,,,12,"Basemental drugs, gangs, Kritical, Nisak, Wicked whims",,,,LOT00220,
Oasis Springs,Raffia Quinta ,Wright & Order,Law Office,(Kiara Sims 4) Law Office ,,,Parched Prospect ,"§54,050",20x15,Not Started,,,,,,,Community,,,13,Kiarasims4 lawyer career,,,,LOT00221,
Oasis Springs,Cati Casa,Cati Casa,Residential,Residential ,add storage units,Johnny Zest,Parched Prospect ,"§201,313",40x30,Not Started,,,,,,,Johnny Zest,,"Johnny Zest was cut off by the Landgraabs and decided to build something of his own in Parched Prospect from scratch. La Cosa Simstra doesn't have numbers or power yet, but Johnny has the ambition and the patience to get there, and he is already making the kinds of relationships that will matter when it does.",14,"Basemental, Rsvn garden stuff, haorders, Lot51 doorbell , wicked whims",,,,LOT00222,
Oasis Springs,Springscape ,Springscape ,Residential,Residential ,"Aurora Palolhat, but after moves in Gussavo Narravo",Aurora Palolhati,Parched Prospect ,,30x20,Not Started,,,,,,,The Landgraabs,,"Aurora has always known how to stay on top, which is a skill that looks effortless until you watch how carefully she applies it. She brought Gussavo in on her own terms and has kept everything around her exactly as ordered as she wants it. Oasis Springs is only just getting started, and so is she.",15,,,,,LOT00223,
Oasis Springs,Vista Quarry ,Gilded dice dune,Illegal Casino,La cosa simstra Illegal Casino ,"dice cc vfx connect, unhappy with the building",,Parched Prospect ,,30x20 ,Not Started,,,,,,,la costa simstra,,,16,"Wicked whims, RSVN VFX , Basemental drugs, gangs, gambling
CClotrait bouncer",,,,LOT00224,
Oasis Springs,Dusty Turf,Obsidian Risk Solutions,Gang HQ,La cosa simstra HQ ,,,Parched Prospect ,"§145,219",30x20 ,Not Started,,,,,,,la costa simstra,,,17,"rsvn hoarders synonymous, Littlemssam pet water bowl, GANG folder, RSVN hoarder's synonymous, basemental drugs basemental gangs Wicked whims",,,,LOT00225,
Oasis Springs,Sultry Springside ,Sultry Springside ,Lounge,Country Club,,,Skyward Palms ,"§134,243",30x20,Not Started,,,,,,,Community,,,18,"wicked whims, Nisak
CClottrait Maplebell country club",,,,LOT00226,
Oasis Springs,Arid Ridge ,Arid Ridge ,Residential,Residential ,add regal clandestine lot traits,Kason Blackwood,Skyward Palms ,"§464,114",40x30,Not Started,,,,,,,Kason Blackwood,,"Kason Blackwood is the kind of man who has a legitimate front and an illegitimate everything else. The strip club is real. The connections to politicians and lawyers are real. The women in his orbit who think they are navigating him are real, and so is the fact that he has already decided what role each of them is going to play. He is charming, patient, and genuinely dangerous, and Oasis Springs belongs to him in every way that matters.",19,"lot51 doorbell, nisak , kritical, basemental drugs, gambling, gang Arnie casino, wicked whims, Wicked whims animation objects",,,,LOT00227,
Oasis Springs,Granada Place ,Granada Place ,Small Business Venue Lot,Adult Business/Service lot,owned by Kason ,,Skyward Palms ,,30x20,Not Started,,,,,,,Kason Blackwood,,,20,"nisak , kritical, basemental drugs, gambling, gang Arnie casino, wicked whims, Wicked whims animation objects",,,,LOT00228,
Oasis Springs,Rio Verde ,Rio Verde ,Residential,Residential ,,The Al-Nahyans,Skyward Palms ,"§234,219",40x30,Not Started,,,,,,,The Al-Nahyans,,"Sultan is an oil tycoon with investments in nearly everything and influence in more. Amira is his very young wife who drinks too much. Maha is the daughter who knows her worth and says so constantly. Zayed is the son everyone overlooks, which is going to be someone's mistake eventually.",21,"Lot51 doorbell, Law and disorder, wicked whims",,,,LOT00229,
Ondarion,Dambele Palace,Dambele Palace,Residential,,,Darong family,Dambele,,50x50,Not Started,,,,,,,Darong family,,"Strength Through Union has been the Darong family motto for generations, and it has held. Jawara has spent years earning favour across the kingdom through philanthropy and grace, and the path to the crown seemed smooth until her husband died suddenly and the scrutiny that followed started asking whether this perfect family was really as spotless as it appeared. Jawara is pressing forward. The family is closing ranks behind her.",1,,,,,LOT00230,
Ondarion,Zanbira Market,Zanbira Market,Market,,,,Dambele,,30x20,Not Started,,,,,,,Community,,,2,,,,,LOT00231,
Ondarion,Bright Cliff Apartments,Bright Cliff Apartments,Apartment,17 Bright Cliff,,Guidroz Family,Dambele,,,Not Started,,,,,,,Guidroz Family,,"Layla and Kirk are both photographers, which is what brought them together and also, quietly, what pulls them apart. Layla chases moments. Kirk builds narratives. They have the same eye and a completely different idea of what to do with it, and the creative tension between them has a way of bleeding into everything else.",3,,,,,LOT00232,
Ondarion,Bright Cliff Apartments,Bright Cliff Apartments,Apartment,18 Bright Cliff,,Ananou family,Dambele,,,Not Started,,,,,,,Ananou family,,"Ekene is a modest artisan who has spent his later years raising his granddaughter Afua after her mother's passing. The father? Well. Ekene says he was simply too different from the rest of them and that it was mutually agreed Afua would grow up an Ananou, living a regular life. People in Dambele still gossip about it. Some have noticed the donations that appear in the Ananous' mailbox from time to time. Ekene and Afua are playful, warm, and welcoming, as long as you do not mind the pranks.",3.1,,,,,LOT00233,LOT00232
Ondarion,Hardcover,Hardcover,Backroom,,,,Dambele,,20x20,Not Started,,,,,,,Community,,,4,,,,,LOT00234,
Ondarion,Sankofa Residence,Sankofa Residence,Residential,,,Nguyen Family,Dambele,,30x20,Not Started,,,,,,,Nguyen Family,,"Tuan is doing it alone: two very small children, a household to hold together, and whatever it takes to make the days work. It is not glamorous and he is not asking for credit.",5,,,,,LOT00235,
Ondarion,Verdemar Palace,Verdemar Palace,Residential,,,"	Thebe family",Verdemar Palace,,50x50,Not Started,,,,,,,"	Thebe family",,"Cordelia Thebe V came home from years at sea and settled down, which surprised everyone including possibly herself. Now married to Thiago Abrantes and well-positioned in the race to the throne, she has everything a candidate could want and the restlessness of someone who has always wanted to be somewhere else instead.",6,,,,,LOT00236,
Ondarion,Casa Do Corsário,Casa Do Corsário,Residential,,,Aloisio Romualdo,Verdemar Palace,,20x15,Not Started,,,,,,,Aloisio Romualdo,,"Aloisio learned early that the ends justify the means and has been living by that ever since. He moved to Verdemar from Dambele with ambition and a clear eye for opportunity, and whether he ends up fighting inequality or exploiting it depends entirely on which one is more useful at the time.",7,,,,,LOT00237,
Ondarion,Abrantes Estate,Abrantes Estate,Residential,,,Abrantes Family,Verdemar Palace,,30x30,Not Started,,,,,,,Abrantes Family,,"Ermelinda has achieved what she set out to achieve: her son married well, the family has ascended, and she could retire. She has not retired. Sofia is her teenage daughter, still naive enough to stumble across court scandals without fully understanding what she's found, which makes her either an asset or a liability depending on the day.",8,,,,,LOT00238,
Ondarion,Fisherman's Hut,Fisherman's Hut,Residential,,,Fosters,Verdemar Palace,,20x20,Not Started,,,,,,,Fosters,,"Daniel and Laura are so reliably normal that Jisoo has spent her whole childhood trying to be anything but. She tries everything, joins everything, and knows far more popular people than anyone looking at her from the outside would expect. Baby Jiwon has just arrived and has not yet formed an opinion on any of this.",9,,,,,LOT00239,
Ondarion,Ye Olde Voyager,Ye Olde Voyager,Bar,,,,Verdemar Palace,,30x20,Not Started,,,,,,,Community,,,10,,,,,LOT00240,
Ondarion,The Lair in the Open-Air,The Emerald Stage,Custom Venue,Ballet studio,,,Verdemar Palace,,30x20,Not Started,,,,,,,Community,,,11,,,,,LOT00241,
Ondarion,Bellacorde Palace,Bellacorde Palace,Residential,,,Capp Family,Bellacorde,,50x50,Not Started,,,,,,,Capp Family,,"Tybalt has the money, the house, and the highest noble ranking in Bellacorde. He also wants to be king, which he considers a natural next step. His three adult children refuse to settle down and marry, which is the one stain on an otherwise perfect image: Beatrice who could have anyone but wants something meaningful, Celeste who takes the family motto with an earnestness Tybalt finds baffling, and Virgilio who calls high society a collection of hypocrites and is not entirely wrong.",12,,,,,LOT00242,
Ondarion,Renaissance Road,Renaissance Road,Residential,,,Monty Family,Bellacorde,,20x15,Not Started,,,,,,,Monty Family,,"Juliette followed her heart, lost her noble ranking, and lost most of her fortune, and has spent every day since deciding it was worth it. She and Romeo are settled now, Dante is growing up with his father's kindness, and Juliette has started to think about what it would take to reclaim what was taken from her.",13,,,,,LOT00243,
Ondarion,Lakeview Apartments,Lakeview Apartments,Apartment,12 Lakeview Apartments,,Tage Scherich,Bellacorde,,,Not Started,,,,,,,Tage Scherich,,"Tage is a young lawyer in Bellacorde who still believes the law means something, which is either the most admirable quality in the room or the most fragile one depending on who you ask. The hope in his eyes has not dimmed yet. Give it time.",14,,,,,LOT00244,
Ondarion,Bright Cliff Apartments,Bright Cliff Apartments,Apartment,13 Lakeview Apartments,,Ixia Underhill,Bellacorde,,,Not Started,,,,,,,Ixia Underhill,,"Life in Bellacorde was not always this comfortable for Ixia. Working for Kason has a way of solving certain problems very efficiently, and as long as she keeps doing what she does and keeps her mouth shut about the rest of it, the apartment stays nice and the money stays good. So far so good.",14.1,,,,,LOT00245,LOT00244
Ondarion,La Vivace,La Vivace,Lounge,,,,Bellacorde,,40x30,Not Started,,,,,,,Community,,,15,,,,,LOT00246,
Ondarion,Giardino Del Grandioso,Giardino Del Grandioso,Custom Venue,Theatre/opera house,,,Bellacorde,,64x64,Not Started,,,,,,,Community,,,16,,,,,LOT00247,
Ravenwood,Netherworld Department,Netherworld Department,Headless Quarter,,,,Ravenwood,,20x20,Not Started,,,,,,,Community,,,0,,,,,LOT00248,
Ravenwood,Specter Family Manor,Specter Family Manor,Residential,,,Specter Family,Crow's Crossing,,30x20,Not Started,,,,,,,Specter Family,,"Rumour has it that Olive Specter's prior husbands all met unfortunate ends. Layne Coffin, founder and sole member of the band Withering Widdershins, is her current fiance and has apparently decided not to ask too many questions about that. Nyon's parentage is similarly not up for discussion. What is clear is that the Grim Reaper checks in on this household with unusual frequency, and not all of it is explained by Olive's romantic history.",1,,,,,LOT00249,
Ravenwood,Crow's Perch,Crow's Perch,Nightclub,,Ban walkers,,Crow's Crossing,,30x30,Not Started,,,,,,,,,,2,CClot nisak trait ban walkers,,,,LOT00250,
